{
  "version": "yellow-beast-mission-worldpack@v1", "worldpack_id": "authoring-fixture",
  "mission": {
    "id": "fixture-inspection", "version": 1, "display_name": "Fixture Inspection", "briefing": "Inspect the worksite panel and return by either route.", "operational_intent": "Prove generic authoring, logistics, hazard, institutional, and alternate-outcome behavior.",
    "objectives": [{ "id": "fixture-inspect", "name": "Inspect the worksite panel", "kind": "required", "behavior": "sticky", "initial_state": "active", "satisfaction": { "source": "object", "predicate": "property_known", "object_id": "fixture-panel", "property": "fixture-panel-stable" }, "public": { "active": "The worksite panel remains unchecked.", "satisfied": "The worksite panel is documented.", "abandoned": "The inspection was abandoned.", "next_requirement": "Inspect the visible panel." } }],
    "return_policy": { "return_location": "fixture-base", "route_available_when": { "any": [{ "source": "spatial", "predicate": "route_traversed", "connection_id": "fixture-primary" }, { "source": "spatial", "predicate": "route_traversed", "connection_id": "fixture-bypass-base" }] }, "ready_when": { "source": "mission", "predicate": "objective_state", "objective_id": "fixture-inspect", "states": ["satisfied"] }, "closure_available_when": { "source": "spatial", "predicate": "returned", "location_id": "fixture-base" }, "completion_when": { "all": [{ "source": "mission", "predicate": "closure_requested" }, { "source": "spatial", "predicate": "returned", "location_id": "fixture-base" }] }, "public": { "unavailable": "No return route is confirmed.", "available": "A return route is confirmed.", "ready": "Inspection and return are ready.", "requested": "Return begun.", "closure_requested": "Closure requested.", "closure_unavailable": "Return to base before closure." } },
    "completion_policy": { "required": "all_terminal", "waived_counts": true, "optional_blocks": false }, "abort_policy": { "available_when": { "constant": true }, "unresolved_state": "abandoned", "keep_objectives": [], "public_reason": "Controlled abort declared.", "public_unavailable": "Abort unavailable." },
    "outcome_rules": [{ "id": "fixture-abort", "priority": 10, "when": { "source": "mission", "predicate": "abort_requested" }, "final_state": "aborted", "classification": "controlled-abort", "public_summary": "The fixture inspection was aborted.", "institutional_hooks": ["controlled_abort"] }, { "id": "fixture-recovered", "priority": 8, "when": { "all": [{ "source": "mission", "predicate": "objective_state", "objective_id": "fixture-inspect", "states": ["satisfied"] }, { "source": "mission", "predicate": "consequence_recovered" }] }, "final_state": "completed", "classification": "recovered-complication", "public_summary": "The fixture inspection is complete after a recovered field complication.", "institutional_hooks": ["recovered_complication"] }, { "id": "fixture-complete", "priority": 5, "when": { "source": "mission", "predicate": "objective_state", "objective_id": "fixture-inspect", "states": ["satisfied"] }, "final_state": "completed", "classification": "clean-completion", "public_summary": "The fixture inspection is complete.", "institutional_hooks": ["clean_completion"] }, { "id": "fixture-failure", "priority": 0, "when": { "constant": true }, "final_state": "failed", "classification": "mission-failure", "public_summary": "The fixture inspection was not completed.", "institutional_hooks": ["mission_failure"] }],
    "public_progress": { "required_heading": "Required objectives", "optional_heading": "Optional objectives", "blockers_heading": "Current blockers", "updates_heading": "Recent updates", "return_heading": "Return readiness" }, "migration": { "from_versions": [], "legacy_objective_map": {} }
  }, "known_limitations": ["This is an authoring fixture."]
}
